{
  "$schema": "https://json-schema.org/draft/2020-12/schema",
  "$id": "urn:inji-conformance:schema:results:v1",
  "title": "Conformance results, version 1",
  "description": "One results.json per component and run. The runner writes it after a suite test plan finished; the gate, the HTML report, CI and the TestNG bridge in the testrigs read it. The runner computes each module's verdict once; readers map the verdict and never re-classify. Rules that JSON Schema cannot express (summary counts, gate consistency, verdict against suite result) are checked by inji-conformance validate and are listed in conformance/schema/README.md.",
  "type": "object",
  "required": ["schema_version", "run_id", "component", "track", "gating", "suite", "target", "plan", "modules", "summary", "gate"],
  "additionalProperties": false,
  "properties": {
    "schema_version": {"const": "1"},
    "run_id": {"$ref": "#/$defs/run_id"},
    "component": {"$ref": "#/$defs/component"},
    "track": {
      "description": "gate: the 1.0 Final plans the benchmark gates on. haip: the HAIP certification plans, run as a readiness track that never changes the exit code.",
      "enum": ["gate", "haip"]
    },
    "gating": {
      "description": "false when this file must not change the exit code (the haip track).",
      "type": "boolean"
    },
    "started_at": {"$ref": "#/$defs/timestamp"},
    "finished_at": {"$ref": "#/$defs/timestamp"},
    "suite": {
      "type": "object",
      "required": ["base_url", "version"],
      "additionalProperties": false,
      "properties": {
        "base_url": {"$ref": "#/$defs/http_url"},
        "version": {"type": "string", "minLength": 1, "description": "Suite version as reported by the suite, for example 5.3.1."},
        "image": {"type": "string", "minLength": 1},
        "digest": {"$ref": "#/$defs/digest"}
      }
    },
    "target": {
      "description": "The system under test.",
      "type": "object",
      "required": ["base_url"],
      "additionalProperties": false,
      "properties": {
        "base_url": {"$ref": "#/$defs/http_url"},
        "image": {"type": "string", "minLength": 1},
        "digest": {"$ref": "#/$defs/digest"},
        "commit": {"$ref": "#/$defs/commit"},
        "version": {"type": "string", "minLength": 1}
      }
    },
    "plan": {
      "type": "object",
      "required": ["name", "variant"],
      "additionalProperties": false,
      "properties": {
        "name": {"type": "string", "pattern": "^[a-z0-9][a-z0-9_.-]*$", "description": "Suite test plan name, for example oid4vp-1final-verifier-test-plan."},
        "id": {"type": ["string", "null"], "minLength": 1, "description": "Plan id the suite assigned; null when the plan was never created."},
        "variant": {"$ref": "#/$defs/variant"},
        "config_file": {"$ref": "#/$defs/relative_path", "description": "Rendered suite configuration, relative to the run folder. Never committed: it holds private keys."},
        "export": {"$ref": "#/$defs/relative_path", "description": "Plan export zip, relative to the run folder."},
        "certification_profile": {"type": ["string", "null"]}
      }
    },
    "modules": {
      "type": "array",
      "items": {"$ref": "#/$defs/module"}
    },
    "summary": {
      "description": "Counts of modules per verdict. total equals the number of modules, and the five verdict counts add up to total.",
      "type": "object",
      "required": ["total", "conforms", "known_gap", "regression", "not_applicable", "stale_benchmark"],
      "additionalProperties": false,
      "properties": {
        "total": {"$ref": "#/$defs/count"},
        "conforms": {"$ref": "#/$defs/count"},
        "known_gap": {"$ref": "#/$defs/count"},
        "regression": {"$ref": "#/$defs/count"},
        "not_applicable": {"$ref": "#/$defs/count"},
        "stale_benchmark": {"$ref": "#/$defs/count"}
      }
    },
    "gate": {
      "type": "object",
      "required": ["passed", "exit_code"],
      "additionalProperties": false,
      "properties": {
        "passed": {"type": "boolean"},
        "exit_code": {
          "description": "0 passed, 1 gate failed (regression or stale benchmark entry), 2 usage or configuration error, 3 environment not ready, 4 whole-run timeout.",
          "enum": [0, 1, 2, 3, 4]
        },
        "allow_stale": {"type": "boolean", "description": "true when the run used --allow-stale: stale benchmark entries warn instead of failing."},
        "benchmark_files": {"type": "array", "items": {"$ref": "#/$defs/relative_path"}},
        "messages": {"type": "array", "items": {"type": "string", "minLength": 1}}
      }
    },
    "notes": {
      "description": "Free-text notes about the run, for people.",
      "type": "array",
      "items": {"type": "string", "minLength": 1}
    }
  },
  "$defs": {
    "run_id": {
      "description": "UTC start time plus a suffix, for example 20261004T193000Z-1a2b3c4. Sorts by time.",
      "type": "string",
      "pattern": "^[0-9]{8}T[0-9]{6}Z(-[A-Za-z0-9._-]+)?$"
    },
    "component": {"enum": ["certify", "verify"]},
    "timestamp": {
      "description": "RFC 3339 date and time with a time zone, for example 2026-10-04T19:30:00Z.",
      "type": "string",
      "format": "date-time",
      "pattern": "^[0-9]{4}-[0-9]{2}-[0-9]{2}T[0-9]{2}:[0-9]{2}:[0-9]{2}(\\.[0-9]+)?(Z|[+-][0-9]{2}:[0-9]{2})$"
    },
    "http_url": {"type": "string", "pattern": "^https?://[^\\s/]+(/\\S*)?$"},
    "digest": {"type": ["string", "null"], "pattern": "^sha256:[0-9a-f]{64}$"},
    "commit": {"type": ["string", "null"], "pattern": "^[0-9a-f]{7,40}$"},
    "relative_path": {
      "description": "Path relative to the run folder: forward slashes, no leading slash, no drive letter, no '..'.",
      "type": "string",
      "minLength": 1,
      "pattern": "^(?![A-Za-z]:)(?!/)(?!.*(^|/)\\.\\.(/|$))[^\\\\\\s][^\\\\]*$"
    },
    "count": {"type": "integer", "minimum": 0},
    "variant": {
      "description": "Variant selections as the suite reports them (name to value).",
      "type": "object",
      "additionalProperties": {"type": "string", "minLength": 1}
    },
    "verdict": {
      "description": "Harness verdict (README, verdict table): conforms, known_gap (every problem is listed in the benchmark), regression (gate fails), not_applicable (expected skip), stale_benchmark (a listed problem did not happen; gate fails unless --allow-stale).",
      "enum": ["conforms", "known_gap", "regression", "not_applicable", "stale_benchmark"]
    },
    "module": {
      "type": "object",
      "required": ["name", "test_id", "status", "result", "verdict"],
      "additionalProperties": false,
      "properties": {
        "name": {"type": "string", "pattern": "^[a-z0-9][a-z0-9_.-]*$"},
        "test_id": {"type": ["string", "null"], "minLength": 1, "description": "Suite test id; null when the module never started."},
        "description": {"type": "string", "description": "The suite's summary of the module, shown in reports and TestNG rows."},
        "variant": {"$ref": "#/$defs/variant"},
        "status": {
          "description": "Last suite status. NOT_STARTED is the harness's own value for a module of the plan that never started.",
          "enum": ["NOT_STARTED", "CREATED", "CONFIGURED", "WAITING", "RUNNING", "FINISHED", "INTERRUPTED", "UNKNOWN"]
        },
        "result": {
          "description": "Suite result; null while the module has none (not finished).",
          "enum": ["PASSED", "FAILED", "WARNING", "REVIEW", "SKIPPED", "UNKNOWN", null]
        },
        "verdict": {"$ref": "#/$defs/verdict"},
        "verdict_reason": {
          "description": "One line on why the verdict was given; required for regression and stale_benchmark. Used as the TestNG failure message.",
          "type": "string",
          "minLength": 1
        },
        "failures": {
          "description": "Every FAILURE and WARNING log entry of the module.",
          "type": "array",
          "items": {"$ref": "#/$defs/failure"}
        },
        "benchmark": {
          "description": "Benchmark entries that apply to this module, copied from the benchmark files, with whether each matched.",
          "type": "array",
          "items": {"$ref": "#/$defs/benchmark_ref"}
        },
        "review": {"$ref": "#/$defs/review"},
        "handoffs": {
          "type": "array",
          "items": {"$ref": "#/$defs/handoff"}
        },
        "links": {
          "type": "object",
          "additionalProperties": false,
          "properties": {
            "suite_log": {"$ref": "#/$defs/http_url", "description": "Live log page on the suite; works while the suite runs."},
            "export": {"$ref": "#/$defs/relative_path", "description": "Extracted HTML export, relative to the run folder; works after teardown."}
          }
        },
        "duration_s": {"type": ["number", "null"], "minimum": 0}
      }
    },
    "failure": {
      "type": "object",
      "required": ["condition", "severity"],
      "additionalProperties": false,
      "properties": {
        "condition": {"type": "string", "pattern": "^[A-Za-z_][A-Za-z0-9_]*$"},
        "severity": {"enum": ["FAILURE", "WARNING"]},
        "message": {"type": "string"},
        "block": {"type": "string", "description": "Title of the block the condition ran in; \"\" when outside any block."},
        "requirements": {"type": "array", "items": {"type": "string", "minLength": 1}},
        "expected": {"type": "boolean", "description": "true when a benchmark entry lists this condition."}
      }
    },
    "benchmark_ref": {
      "type": "object",
      "required": ["kind", "comment", "owner", "spec", "issue", "matched"],
      "additionalProperties": false,
      "properties": {
        "kind": {"enum": ["expected_failure", "expected_skip"]},
        "condition": {"type": "string", "pattern": "^[A-Za-z_][A-Za-z0-9_]*$"},
        "current_block": {"type": "string"},
        "expected_result": {"enum": ["failure", "warning"]},
        "comment": {"type": "string", "minLength": 10},
        "owner": {"$ref": "urn:inji-conformance:schema:benchmark:v1#/$defs/owner"},
        "spec": {"type": "string", "minLength": 1},
        "issue": {"type": "string", "minLength": 1},
        "matched": {"type": "boolean", "description": "false when the listed problem did not occur in this run (a stale entry)."}
      }
    },
    "review": {
      "description": "Checked outcome of a module the suite ends in REVIEW: the verdict Inji Verify showed, compared with what the module expects.",
      "type": "object",
      "required": ["expected", "observed", "evidence"],
      "additionalProperties": false,
      "properties": {
        "expected": {"enum": ["valid", "invalid"]},
        "observed": {"enum": ["valid", "invalid", "missing"]},
        "evidence": {
          "description": "Image uploaded to the suite as evidence, relative to the run folder; null when none was made.",
          "oneOf": [{"$ref": "#/$defs/relative_path"}, {"type": "null"}]
        }
      }
    },
    "handoff": {
      "description": "One step the harness performed where the suite waits for a person or for the system under test.",
      "type": "object",
      "required": ["kind", "http_status", "duration_ms"],
      "additionalProperties": false,
      "properties": {
        "kind": {
          "enum": ["authorization_request", "credential_offer", "tx_code", "start_test", "browser_visit", "verification_evidence"]
        },
        "at": {"$ref": "#/$defs/timestamp"},
        "http_status": {"type": ["integer", "null"], "minimum": 100, "maximum": 599, "description": "Status of the HTTP call that delivered the handoff; null when no response arrived."},
        "duration_ms": {"type": "number", "minimum": 0},
        "detail": {"type": "string"},
        "error": {"type": "string"}
      }
    }
  }
}
